{
  "taskId": "task_security_modernization",
  "prompt": "How should a security platform modernize long-lived protection workflows for new algorithm requirements?",
  "objective": "Generate structurally grounded migration candidates for evolving security architectures.",
  "domainHints": ["security", "distributed-systems", "operations"],
  "constraints": ["portable contracts", "incremental rollout"],
  "evaluationTargets": ["structural validity", "feasibility", "reusability"],
  "graph": {
    "graphId": "graph_discovery_workflow",
    "roles": [
      { "roleId": "abstraction_role", "title": "Abstraction Role", "interactionPattern": "sequential" },
      { "roleId": "analysis_role", "title": "Analysis Role", "interactionPattern": "fanout" },
      { "roleId": "review_role", "title": "Review Role", "interactionPattern": "review" },
      { "roleId": "synthesis_role", "title": "Synthesis Role", "interactionPattern": "collapse" }
    ],
    "edges": [
      { "from": "abstraction_role", "to": "analysis_role", "relation": "informs" },
      { "from": "analysis_role", "to": "review_role", "relation": "supports" },
      { "from": "review_role", "to": "synthesis_role", "relation": "refines" }
    ],
    "phases": ["abstraction", "analysis", "review", "synthesis"]
  },
  "mode": "default"
}
